{
  "formatVersion": "panorama.process-assessment.v1",
  "purpose": "contract_example",
  "assessmentId": "fixture:hogwarts-impact-unknown:assessment",
  "assessmentHash": "7b25847a6bdb0be357ed2c54318c8e8c37ea77f86caf41f3523e8b56c23083bf",
  "binding": {
    "authority": "structure-core",
    "projectId": "fixture:hogwarts:project",
    "checkoutId": "fixture:hogwarts:checkout",
    "panoramaProjectId": null
  },
  "workItemRef": {
    "id": "fixture:hogwarts-impact-unknown:work",
    "definitionDigest": "e7e46a5ce93d771d175c958b8909713ff0b62d3812a923c0599944872660cb5d"
  },
  "rulePacks": [
    {
      "id": "PANORAMA-PROCESS-BASE",
      "version": "0.1.0",
      "digest": "fe3f280c5820c3432a3cb015bc58c9bb982c2b53b2634d886a9e93dcd8523c9b"
    }
  ],
  "assessor": {
    "id": "p0-expected-result-author",
    "version": "0.1.0",
    "mode": "contract_example"
  },
  "assessedAt": "2026-09-14T00:00:00Z",
  "receiptRefs": [
    {
      "receiptId": "fixture:hogwarts-impact-unknown:receipt",
      "receiptHash": "55c92504611f58dad0ed70ca5ce210d52e53707384c2e92ec3a19dbc88c1f733"
    }
  ],
  "currentInputObservations": [
    {
      "inputSetId": "INPUT-SOURCE",
      "selectionDigest": "cd56186bb067f36fcb4121931d35cba10c2ee1ba2347bb482d4ac73479ceebf8",
      "digest": "90abf75378d1fbc29e36c8b87c41238f7d4906baab5e069fcc1e1c0a41157732",
      "state": "readable",
      "observedAt": "2026-09-14T00:00:00Z"
    }
  ],
  "rules": [
    {
      "ruleId": "BASE-01",
      "ruleVersion": "0.1.0",
      "strength": "required",
      "applicability": {
        "status": "applicable",
        "reason": "基础必备要求。",
        "basisRefs": [
          "urn:fixture:base"
        ]
      },
      "checkRefs": [
        {
          "receiptId": "fixture:hogwarts-impact-unknown:receipt",
          "receiptHash": "55c92504611f58dad0ed70ca5ce210d52e53707384c2e92ec3a19dbc88c1f733",
          "checkId": "CHK-PROCESS"
        }
      ],
      "evidenceRefs": [
        {
          "receiptId": "fixture:hogwarts-impact-unknown:receipt",
          "receiptHash": "55c92504611f58dad0ed70ca5ce210d52e53707384c2e92ec3a19dbc88c1f733",
          "evidenceId": "EV-CHK-PROCESS"
        }
      ],
      "freshness": {
        "status": "current",
        "scope": "declared_inputs_and_subjects",
        "changedIds": [],
        "unknowns": []
      },
      "satisfaction": "satisfied",
      "reason": "合同预期：所需证据结构完整。",
      "missing": []
    },
    {
      "ruleId": "BASE-02",
      "ruleVersion": "0.1.0",
      "strength": "required",
      "applicability": {
        "status": "applicable",
        "reason": "基础必备要求。",
        "basisRefs": [
          "urn:fixture:base"
        ]
      },
      "checkRefs": [
        {
          "receiptId": "fixture:hogwarts-impact-unknown:receipt",
          "receiptHash": "55c92504611f58dad0ed70ca5ce210d52e53707384c2e92ec3a19dbc88c1f733",
          "checkId": "CHK-PROCESS"
        }
      ],
      "evidenceRefs": [
        {
          "receiptId": "fixture:hogwarts-impact-unknown:receipt",
          "receiptHash": "55c92504611f58dad0ed70ca5ce210d52e53707384c2e92ec3a19dbc88c1f733",
          "evidenceId": "EV-CHK-PROCESS"
        }
      ],
      "freshness": {
        "status": "current",
        "scope": "declared_inputs_and_subjects",
        "changedIds": [],
        "unknowns": []
      },
      "satisfaction": "satisfied",
      "reason": "合同预期：所需证据结构完整。",
      "missing": []
    },
    {
      "ruleId": "BASE-03",
      "ruleVersion": "0.1.0",
      "strength": "required",
      "applicability": {
        "status": "applicable",
        "reason": "基础必备要求。",
        "basisRefs": [
          "urn:fixture:base"
        ]
      },
      "checkRefs": [
        {
          "receiptId": "fixture:hogwarts-impact-unknown:receipt",
          "receiptHash": "55c92504611f58dad0ed70ca5ce210d52e53707384c2e92ec3a19dbc88c1f733",
          "checkId": "CHK-PROCESS"
        }
      ],
      "evidenceRefs": [
        {
          "receiptId": "fixture:hogwarts-impact-unknown:receipt",
          "receiptHash": "55c92504611f58dad0ed70ca5ce210d52e53707384c2e92ec3a19dbc88c1f733",
          "evidenceId": "EV-CHK-PROCESS"
        }
      ],
      "freshness": {
        "status": "current",
        "scope": "declared_inputs_and_subjects",
        "changedIds": [],
        "unknowns": []
      },
      "satisfaction": "satisfied",
      "reason": "合同预期：所需证据结构完整。",
      "missing": []
    },
    {
      "ruleId": "BASE-04",
      "ruleVersion": "0.1.0",
      "strength": "required",
      "applicability": {
        "status": "applicable",
        "reason": "基础必备要求。",
        "basisRefs": [
          "urn:fixture:base"
        ]
      },
      "checkRefs": [
        {
          "receiptId": "fixture:hogwarts-impact-unknown:receipt",
          "receiptHash": "55c92504611f58dad0ed70ca5ce210d52e53707384c2e92ec3a19dbc88c1f733",
          "checkId": "CHK-EXECUTION"
        }
      ],
      "evidenceRefs": [
        {
          "receiptId": "fixture:hogwarts-impact-unknown:receipt",
          "receiptHash": "55c92504611f58dad0ed70ca5ce210d52e53707384c2e92ec3a19dbc88c1f733",
          "evidenceId": "EV-CHK-EXECUTION"
        }
      ],
      "freshness": {
        "status": "current",
        "scope": "declared_inputs_and_subjects",
        "changedIds": [],
        "unknowns": []
      },
      "satisfaction": "satisfied",
      "reason": "合同预期：所需证据结构完整。",
      "missing": []
    },
    {
      "ruleId": "BASE-05",
      "ruleVersion": "0.1.0",
      "strength": "required",
      "applicability": {
        "status": "applicable",
        "reason": "基础必备要求。",
        "basisRefs": [
          "urn:fixture:base"
        ]
      },
      "checkRefs": [
        {
          "receiptId": "fixture:hogwarts-impact-unknown:receipt",
          "receiptHash": "55c92504611f58dad0ed70ca5ce210d52e53707384c2e92ec3a19dbc88c1f733",
          "checkId": "CHK-PROCESS"
        }
      ],
      "evidenceRefs": [
        {
          "receiptId": "fixture:hogwarts-impact-unknown:receipt",
          "receiptHash": "55c92504611f58dad0ed70ca5ce210d52e53707384c2e92ec3a19dbc88c1f733",
          "evidenceId": "EV-CHK-PROCESS"
        }
      ],
      "freshness": {
        "status": "current",
        "scope": "declared_inputs_and_subjects",
        "changedIds": [],
        "unknowns": []
      },
      "satisfaction": "satisfied",
      "reason": "合同预期：所需证据结构完整。",
      "missing": []
    },
    {
      "ruleId": "BASE-06",
      "ruleVersion": "0.1.0",
      "strength": "required",
      "applicability": {
        "status": "applicable",
        "reason": "基础必备要求。",
        "basisRefs": [
          "urn:fixture:base"
        ]
      },
      "checkRefs": [
        {
          "receiptId": "fixture:hogwarts-impact-unknown:receipt",
          "receiptHash": "55c92504611f58dad0ed70ca5ce210d52e53707384c2e92ec3a19dbc88c1f733",
          "checkId": "CHK-PROCESS"
        }
      ],
      "evidenceRefs": [
        {
          "receiptId": "fixture:hogwarts-impact-unknown:receipt",
          "receiptHash": "55c92504611f58dad0ed70ca5ce210d52e53707384c2e92ec3a19dbc88c1f733",
          "evidenceId": "EV-CHK-PROCESS"
        }
      ],
      "freshness": {
        "status": "current",
        "scope": "declared_inputs_and_subjects",
        "changedIds": [],
        "unknowns": []
      },
      "satisfaction": "satisfied",
      "reason": "合同预期：所需证据结构完整。",
      "missing": []
    },
    {
      "ruleId": "COND-ARTIFACT",
      "ruleVersion": "0.1.0",
      "strength": "conditional",
      "applicability": {
        "status": "applicable",
        "reason": "delivery.retained-artifact = true（合成输入）",
        "basisRefs": [
          "urn:fixture:fact:delivery.retained-artifact"
        ]
      },
      "checkRefs": [
        {
          "receiptId": "fixture:hogwarts-impact-unknown:receipt",
          "receiptHash": "55c92504611f58dad0ed70ca5ce210d52e53707384c2e92ec3a19dbc88c1f733",
          "checkId": "CHK-ARTIFACT"
        }
      ],
      "evidenceRefs": [
        {
          "receiptId": "fixture:hogwarts-impact-unknown:receipt",
          "receiptHash": "55c92504611f58dad0ed70ca5ce210d52e53707384c2e92ec3a19dbc88c1f733",
          "evidenceId": "EV-CHK-ARTIFACT"
        }
      ],
      "freshness": {
        "status": "current",
        "scope": "declared_inputs_and_subjects",
        "changedIds": [],
        "unknowns": []
      },
      "satisfaction": "satisfied",
      "reason": "合同预期：所需证据结构完整。",
      "missing": []
    },
    {
      "ruleId": "COND-EXTERNAL",
      "ruleVersion": "0.1.0",
      "strength": "conditional",
      "applicability": {
        "status": "not_applicable",
        "reason": "inputs.external = false（合成输入）",
        "basisRefs": [
          "urn:fixture:fact:inputs.external"
        ]
      },
      "checkRefs": [],
      "evidenceRefs": [],
      "freshness": null,
      "satisfaction": null,
      "reason": "本样本不触发该条件。",
      "missing": []
    },
    {
      "ruleId": "COND-INTERFACE",
      "ruleVersion": "0.1.0",
      "strength": "conditional",
      "applicability": {
        "status": "unknown",
        "reason": "change.public-behavior = null（合成输入）",
        "basisRefs": [
          "urn:fixture:fact:change.public-behavior"
        ]
      },
      "checkRefs": [],
      "evidenceRefs": [],
      "freshness": {
        "status": "unknown",
        "scope": "declared_inputs_and_subjects",
        "changedIds": [],
        "unknowns": [
          "影响尚未确定。"
        ]
      },
      "satisfaction": "insufficient",
      "reason": "合同预期：applicability_unknown",
      "missing": [
        "applicability_unknown"
      ]
    },
    {
      "ruleId": "COND-REVIEW",
      "ruleVersion": "0.1.0",
      "strength": "conditional",
      "applicability": {
        "status": "not_applicable",
        "reason": "acceptance.human-review = false（合成输入）",
        "basisRefs": [
          "urn:fixture:fact:acceptance.human-review"
        ]
      },